{
  "schema_version": 1,
  "diagnostic_id": "k4-noctf-collapse-cases30-35-36-h100",
  "recorded_at": "2026-09-01T16:31:09.456241+00:00",
  "record_type": "synthetic_kclass_negative_campaign_collection",
  "registry_disposition": "EXCLUDED_FROM_ACCEPTED_RESULTS",
  "subject": {
    "kind": "synthetic",
    "molecular_family": "CryoBench2 Ribosembly",
    "k": 4,
    "symmetry": "C1",
    "diagnostic_question": "Can removing CTF variation, lowering noise, or improving the initial reference produce a non-collapsed paired K=4 trajectory?"
  },
  "source_structures": [
    {
      "role": "pdb_class_1",
      "path": "/projects/CRYOEM/singerlab/mg6942/cryobench2/Ribosembly/pdbs/000_8c9c.pdb",
      "sha256": "7831ae537ecdaa0559fd8bd0a66bf64f28dc6abd7f68b1693fd4f6b711b565df",
      "size_bytes": 1048862
    },
    {
      "role": "pdb_class_2",
      "path": "/projects/CRYOEM/singerlab/mg6942/cryobench2/Ribosembly/pdbs/001_8c9b.pdb",
      "sha256": "c2d22cccc95d3938bc5902b8a262abb6cc4fc08b4f997035017def2cd0e4e80a",
      "size_bytes": 1271112
    },
    {
      "role": "pdb_class_3",
      "path": "/projects/CRYOEM/singerlab/mg6942/cryobench2/Ribosembly/pdbs/002_8c9a.pdb",
      "sha256": "248abfa5b6c47ae46e564d1b85d061d0512bae9be2713aaa50bc73b272d3cae2",
      "size_bytes": 1453819
    },
    {
      "role": "pdb_class_4",
      "path": "/projects/CRYOEM/singerlab/mg6942/cryobench2/Ribosembly/pdbs/003_8c99.pdb",
      "sha256": "a4d0990124b4400f64ba67d92cbb2961b832c5d75f6a9496568ecff30d82ddaa",
      "size_bytes": 2241474
    }
  ],
  "expected_seeds": [
    41001,
    41002,
    41003
  ],
  "runs": [
    {
      "case_id": 30,
      "name": "ribo_k4_3k_g128_white_noise1_noctf_positive_control",
      "run_root": "/scratch/gpfs/CRYOEM/gilleslab/em_work/codex/k4_symmetry_multiseed_c75cbfffc_20260901",
      "source": {
        "recovar": {
          "commit": "c75cbfffc930e4dac7bcc2785f9220ad8472a5a5",
          "tree": "598f6cad6a17f3980bdded0d25524564b597c944",
          "checkout": "/scratch/gpfs/CRYOEM/gilleslab/mg6942/em_dev/recovar_pr158_k4_symmetry_multiseed_gate_c75cbfffc_20260901",
          "clean": true
        },
        "relion": {
          "commit": "d476e6f6a4f1f37627c06ace5227fc374c0c2b05",
          "tree": "1633d228e89d91ede8ad0996e727ec6ab1bc96ee",
          "checkout": "/scratch/gpfs/CRYOEM/gilleslab/mg6942/em_dev/relion_k4_100k_dispatchv2_20260717/source",
          "source_diff_sha256": "6987c5ce397cbdd98835682cf1481a150c38c48cda621e006341d01a77e11c11",
          "executable": {
            "path": "/scratch/gpfs/CRYOEM/gilleslab/mg6942/em_dev/relion_k4_100k_dispatchv2_20260717/build/bin/relion_refine_mpi",
            "sha256": "01fa9cc870fdce6c19d981d6e917765753406972abcddb0311a40ef88e69a782",
            "size_bytes": 11106320
          }
        },
        "custom_cuda": {
          "path": "/scratch/gpfs/CRYOEM/gilleslab/em_work/codex/k4_symmetry_multiseed_c75cbfffc_20260901/cuda/shared/libcuda_backproject.so",
          "sha256": "266267fb9acfcf9994ec18ba22f74467b3e05369b96252ab936d885c819d98b2",
          "size_bytes": 47142296
        }
      },
      "configuration": {
        "case_id": 30,
        "index": 30,
        "pdb_dir": "/home/mg6942/mytigress/cryobench2/Ribosembly/pdbs",
        "n_classes": 4,
        "n_images": 3000,
        "grid_size": 128,
        "noise_level": 1.0,
        "noise_model": "white",
        "dataset_params_option": "noctf",
        "class_distribution": "uniform",
        "pdb_bfactor": 80.0,
        "init_radius": 10,
        "noise_scale_std": 0.0,
        "contrast_std": 0.0,
        "volume_radius": 0.7,
        "image_offset_n_std": 0.0,
        "percent_outliers": 0.0,
        "max_iter": 5,
        "gpu_monitor_interval_s": 5,
        "legacy_combined_gpu_monitor_interval_s": 60,
        "initial_resolution_ang": 60.0,
        "particle_diameter_ang": 380.0,
        "image_batch_size": 50,
        "rotation_block_size": 2000,
        "symmetry": "C1",
        "base_name": "ribo_k4_3k_g128_white_noise1_noctf_positive_control",
        "base_seed": 2830,
        "shared_input_group": null,
        "shared_input_key": null,
        "shared_input_role": null,
        "shared_input_manifest": null,
        "shared_relion_dir": null,
        "shared_relion_manifest": null
      },
      "reproduction": {
        "command": "cd /scratch/gpfs/CRYOEM/gilleslab/mg6942/em_dev/recovar_pr158_k4_symmetry_multiseed_gate_c75cbfffc_20260901 && unset PYTHONPATH PYTHONHOME CONDA_PREFIX VIRTUAL_ENV RECOVAR_FINAL_ALL_DATA_GRID_CORRECT RECOVAR_FINAL_ALL_DATA_AFTER_MAX_ITER EM_KCLASS_MATRIX_MAX_ITER EM_KCLASS_MATRIX_TIME_LIMIT EM_KCLASS_MATRIX_SEED EM_KCLASS_MATRIX_SEED_OFFSET EM_KCLASS_MATRIX_EXCLUSIVE && export PYTHONNOUSERSITE=1 XLA_PYTHON_CLIENT_PREALLOCATE=false RELION_SRC_DIR=/scratch/gpfs/CRYOEM/gilleslab/mg6942/em_dev/relion_k4_100k_dispatchv2_20260717/source/src EM_KCLASS_MATRIX_RELION_REFINE_MPI=/scratch/gpfs/CRYOEM/gilleslab/mg6942/em_dev/relion_k4_100k_dispatchv2_20260717/build/bin/relion_refine_mpi EM_KCLASS_MATRIX_PIXI_PY=/scratch/gpfs/CRYOEM/gilleslab/mg6942/em_dev/recovar_pr158_realdata_science_equiv_20260830/.pixi/envs/default/bin/python3.11 SBATCH_ACCOUNT=gilles SBATCH_PARTITION=cryoem SBATCH_CONSTRAINT=h100 EM_KCLASS_MATRIX_SETUP_PARTITION=cpu EM_KCLASS_MATRIX_SETUP_CONSTRAINT='' EM_KCLASS_MATRIX_SUMMARY_PARTITION=cpu EM_KCLASS_MATRIX_SUMMARY_CONSTRAINT='' RELION_MODULE=relion/5.0.0/gcc-11.5.0 RELION_MPI_RANKS=3 KCLASS_IMAGE_BATCH_SIZE=50 KCLASS_ROTATION_BLOCK_SIZE=2000 EM_KCLASS_MATRIX_GT_ALIGN_REFINE_ORDERS=3 && export FRESH_RUN_ROOT=/scratch/gpfs/CRYOEM/gilleslab/em_work/codex/k4_case30_negative_replay && test ! -e \"$FRESH_RUN_ROOT\" && /scratch/gpfs/CRYOEM/gilleslab/mg6942/em_dev/recovar_pr158_realdata_science_equiv_20260830/.pixi/envs/default/bin/python3.11 scripts/run_em_kclass_robustness_matrix_slurm.py --scratch-dir \"$FRESH_RUN_ROOT\" --three-seed-suite --case 30 --watch",
        "environment": {
          "set": {
            "PYTHONNOUSERSITE": "1",
            "XLA_PYTHON_CLIENT_PREALLOCATE": "false",
            "RELION_SRC_DIR": "/scratch/gpfs/CRYOEM/gilleslab/mg6942/em_dev/relion_k4_100k_dispatchv2_20260717/source/src",
            "EM_KCLASS_MATRIX_RELION_REFINE_MPI": "/scratch/gpfs/CRYOEM/gilleslab/mg6942/em_dev/relion_k4_100k_dispatchv2_20260717/build/bin/relion_refine_mpi",
            "EM_KCLASS_MATRIX_PIXI_PY": "/scratch/gpfs/CRYOEM/gilleslab/mg6942/em_dev/recovar_pr158_realdata_science_equiv_20260830/.pixi/envs/default/bin/python3.11",
            "SBATCH_ACCOUNT": "gilles",
            "SBATCH_PARTITION": "cryoem",
            "SBATCH_CONSTRAINT": "h100",
            "EM_KCLASS_MATRIX_SETUP_PARTITION": "cpu",
            "EM_KCLASS_MATRIX_SETUP_CONSTRAINT": "",
            "EM_KCLASS_MATRIX_SUMMARY_PARTITION": "cpu",
            "EM_KCLASS_MATRIX_SUMMARY_CONSTRAINT": "",
            "RELION_MODULE": "relion/5.0.0/gcc-11.5.0",
            "RELION_MPI_RANKS": "3",
            "KCLASS_IMAGE_BATCH_SIZE": "50",
            "KCLASS_ROTATION_BLOCK_SIZE": "2000",
            "EM_KCLASS_MATRIX_GT_ALIGN_REFINE_ORDERS": "3"
          },
          "confirmed_unset": [
            "PYTHONPATH",
            "PYTHONHOME",
            "CONDA_PREFIX",
            "VIRTUAL_ENV",
            "RECOVAR_FINAL_ALL_DATA_GRID_CORRECT",
            "RECOVAR_FINAL_ALL_DATA_AFTER_MAX_ITER",
            "EM_KCLASS_MATRIX_MAX_ITER",
            "EM_KCLASS_MATRIX_TIME_LIMIT",
            "EM_KCLASS_MATRIX_SEED",
            "EM_KCLASS_MATRIX_SEED_OFFSET",
            "EM_KCLASS_MATRIX_EXCLUSIVE"
          ]
        },
        "fresh_root_required": true
      },
      "support_jobs": [
        {
          "job_id": "13301401",
          "status": "COMPLETED",
          "elapsed_s": 61,
          "exit_code": "0:0",
          "node": "della-r3c4n15",
          "req_tres": "billing=16,cpu=8,mem=64G,node=1",
          "alloc_tres": "billing=16,cpu=8,mem=64G,node=1",
          "max_rss_kib": 3006748,
          "role": "setup",
          "logs": [
            "/scratch/gpfs/CRYOEM/gilleslab/em_work/codex/k4_symmetry_multiseed_c75cbfffc_20260901/em_kclass_matrix_setup.out",
            "/scratch/gpfs/CRYOEM/gilleslab/em_work/codex/k4_symmetry_multiseed_c75cbfffc_20260901/em_kclass_matrix_setup.err"
          ]
        },
        {
          "job_id": "13301426",
          "status": "COMPLETED",
          "elapsed_s": 99,
          "exit_code": "0:0",
          "node": "della-r3c3n10",
          "req_tres": "billing=16,cpu=2,mem=64G,node=1",
          "alloc_tres": "billing=16,cpu=2,mem=64G,node=1",
          "max_rss_kib": 60360,
          "role": "summary",
          "logs": [
            "/scratch/gpfs/CRYOEM/gilleslab/em_work/codex/k4_symmetry_multiseed_c75cbfffc_20260901/em_kclass_matrix_summary.out",
            "/scratch/gpfs/CRYOEM/gilleslab/em_work/codex/k4_symmetry_multiseed_c75cbfffc_20260901/em_kclass_matrix_summary.err"
          ]
        }
      ],
      "shared_artifacts": [
        {
          "role": "safe_to_delete_marker",
          "path": "/scratch/gpfs/CRYOEM/gilleslab/em_work/codex/k4_symmetry_multiseed_c75cbfffc_20260901/SAFE_TO_DELETE",
          "sha256": "e3b0c44298fc1c149afbf4c8996fb92427ae41e4649b934ca495991b7852b855",
          "size_bytes": 0
        },
        {
          "role": "case_table",
          "path": "/scratch/gpfs/CRYOEM/gilleslab/em_work/codex/k4_symmetry_multiseed_c75cbfffc_20260901/case_table.tsv",
          "sha256": "cc7d2f64985c7537b72184d8a2c6a7bca81ffc4edd25c2090500cc8e0abf8a73",
          "size_bytes": 14221
        },
        {
          "role": "submission_environment",
          "path": "/scratch/gpfs/CRYOEM/gilleslab/em_work/codex/k4_symmetry_multiseed_c75cbfffc_20260901/submission.env",
          "sha256": "f71ef2a750887e019dc0f294781dc6b4b6fa3c91fa320253dd4bf43436dfe47a",
          "size_bytes": 2201
        },
        {
          "role": "setup_stdout",